{"candidate_bundle_hash":null,"coverage_report_hash":"0a6702978e34ccf8bd88e8e1d302676ab710b464f2474ded5d50b5625e80b239","decision_lead_time_seconds":21600,"deployable_candidate_success":false,"no_go_reason_codes":["synthetic_input_not_deployable","target_pool_execution_coverage_unmeasured","unmapped_target:dex:0003:form:00:variant:0","unmapped_target:dex:0006:form:00:variant:0","unmapped_target:dex:0009:form:00:variant:0","unmapped_target:dex:0015:form:00:variant:0","unmapped_target:dex:0018:form:00:variant:0","unmapped_target:dex:0024:form:00:variant:0","unmapped_target:dex:0025:form:00:variant:0","unmapped_target:dex:0026:form:00:variant:0","unmapped_target:dex:0026:form:01:variant:0","unmapped_target:dex:0036:form:00:variant:0","unmapped_target:dex:0038:form:00:variant:0","unmapped_target:dex:0038:form:01:variant:0","unmapped_target:dex:0045:form:00:variant:0","unmapped_target:dex:0059:form:00:variant:0","unmapped_target:dex:0059:form:01:variant:0","unmapped_target:dex:0065:form:00:variant:0","unmapped_target:dex:0068:form:00:variant:0","unmapped_target:dex:0071:form:00:variant:0","unmapped_target:dex:0080:form:00:variant:0","unmapped_target:dex:0080:form:02:variant:0","unmapped_target:dex:0094:form:00:variant:0","unmapped_target:dex:0115:form:00:variant:0","unmapped_target:dex:0121:form:00:variant:0","unmapped_target:dex:0127:form:00:variant:0","unmapped_target:dex:0128:form:00:variant:0","unmapped_target:dex:0128:form:01:variant:0","unmapped_target:dex:0128:form:02:variant:0","unmapped_target:dex:0128:form:03:variant:0","unmapped_target:dex:0130:form:00:variant:0","unmapped_target:dex:0132:form:00:variant:0","unmapped_target:dex:0134:form:00:variant:0","unmapped_target:dex:0135:form:00:variant:0","unmapped_target:dex:0136:form:00:variant:0","unmapped_target:dex:0142:form:00:variant:0","unmapped_target:dex:0143:form:00:variant:0","unmapped_target:dex:0149:form:00:variant:0","unmapped_target:dex:0154:form:00:variant:0","unmapped_target:dex:0157:form:00:variant:0","unmapped_target:dex:0157:form:01:variant:0","unmapped_target:dex:0160:form:00:variant:0","unmapped_target:dex:0168:form:00:variant:0","unmapped_target:dex:0181:form:00:variant:0","unmapped_target:dex:0184:form:00:variant:0","unmapped_target:dex:0186:form:00:variant:0","unmapped_target:dex:0196:form:00:variant:0","unmapped_target:dex:0197:form:00:variant:0","unmapped_target:dex:0199:form:00:variant:0","unmapped_target:dex:0199:form:01:variant:0","unmapped_target:dex:0205:form:00:variant:0","unmapped_target:dex:0208:form:00:variant:0","unmapped_target:dex:0211:form:00:variant:0","unmapped_target:dex:0212:form:00:variant:0","unmapped_target:dex:0214:form:00:variant:0","unmapped_target:dex:0227:form:00:variant:0","unmapped_target:dex:0229:form:00:variant:0","unmapped_target:dex:0248:form:00:variant:0","unmapped_target:dex:0254:form:00:variant:0","unmapped_target:dex:0257:form:00:variant:0","unmapped_target:dex:0260:form:00:variant:0","unmapped_target:dex:0279:form:00:variant:0","unmapped_target:dex:0282:form:00:variant:0","unmapped_target:dex:0302:form:00:variant:0","unmapped_target:dex:0303:form:00:variant:0","unmapped_target:dex:0306:form:00:variant:0","unmapped_target:dex:0308:form:00:variant:0","unmapped_target:dex:0310:form:00:variant:0","unmapped_target:dex:0319:form:00:variant:0","unmapped_target:dex:0323:form:00:variant:0","unmapped_target:dex:0324:form:00:variant:0","unmapped_target:dex:0334:form:00:variant:0","unmapped_target:dex:0350:form:00:variant:0","unmapped_target:dex:0351:form:00:variant:0","unmapped_target:dex:0354:form:00:variant:0","unmapped_target:dex:0358:form:00:variant:0","unmapped_target:dex:0359:form:00:variant:0","unmapped_target:dex:0362:form:00:variant:0","unmapped_target:dex:0376:form:00:variant:0","unmapped_target:dex:0389:form:00:variant:0","unmapped_target:dex:0392:form:00:variant:0","unmapped_target:dex:0395:form:00:variant:0","unmapped_target:dex:0398:form:00:variant:0","unmapped_target:dex:0405:form:00:variant:0","unmapped_target:dex:0407:form:00:variant:0","unmapped_target:dex:0409:form:00:variant:0","unmapped_target:dex:0411:form:00:variant:0","unmapped_target:dex:0428:form:00:variant:0","unmapped_target:dex:0442:form:00:variant:0","unmapped_target:dex:0445:form:00:variant:0","unmapped_target:dex:0448:form:00:variant:0","unmapped_target:dex:0450:form:00:variant:0","unmapped_target:dex:0454:form:00:variant:0","unmapped_target:dex:0460:form:00:variant:0","unmapped_target:dex:0461:form:00:variant:0","unmapped_target:dex:0464:form:00:variant:0","unmapped_target:dex:0470:form:00:variant:0","unmapped_target:dex:0471:form:00:variant:0","unmapped_target:dex:0472:form:00:variant:0","unmapped_target:dex:0473:form:00:variant:0","unmapped_target:dex:0475:form:00:variant:0","unmapped_target:dex:0478:form:00:variant:0","unmapped_target:dex:0479:form:00:variant:0","unmapped_target:dex:0479:form:01:variant:0","unmapped_target:dex:0479:form:02:variant:0","unmapped_target:dex:0479:form:03:variant:0","unmapped_target:dex:0479:form:04:variant:0","unmapped_target:dex:0479:form:05:variant:0","unmapped_target:dex:0497:form:00:variant:0","unmapped_target:dex:0500:form:00:variant:0","unmapped_target:dex:0503:form:00:variant:0","unmapped_target:dex:0503:form:01:variant:0","unmapped_target:dex:0505:form:00:variant:0","unmapped_target:dex:0510:form:00:variant:0","unmapped_target:dex:0512:form:00:variant:0","unmapped_target:dex:0514:form:00:variant:0","unmapped_target:dex:0516:form:00:variant:0","unmapped_target:dex:0518:form:00:variant:0","unmapped_target:dex:0530:form:00:variant:0","unmapped_target:dex:0531:form:00:variant:0","unmapped_target:dex:0534:form:00:variant:0","unmapped_target:dex:0545:form:00:variant:0","unmapped_target:dex:0547:form:00:variant:0","unmapped_target:dex:0553:form:00:variant:0","unmapped_target:dex:0560:form:00:variant:0","unmapped_target:dex:0563:form:00:variant:0","unmapped_target:dex:0569:form:00:variant:0","unmapped_target:dex:0571:form:00:variant:0","unmapped_target:dex:0571:form:01:variant:0","unmapped_target:dex:0579:form:00:variant:0","unmapped_target:dex:0584:form:00:variant:0","unmapped_target:dex:0587:form:00:variant:0","unmapped_target:dex:0604:form:00:variant:0","unmapped_target:dex:0609:form:00:variant:0","unmapped_target:dex:0614:form:00:variant:0","unmapped_target:dex:0618:form:00:variant:0","unmapped_target:dex:0618:form:01:variant:0","unmapped_target:dex:0623:form:00:variant:0","unmapped_target:dex:0635:form:00:variant:0","unmapped_target:dex:0637:form:00:variant:0","unmapped_target:dex:0652:form:00:variant:0","unmapped_target:dex:0655:form:00:variant:0","unmapped_target:dex:0658:form:00:variant:0","unmapped_target:dex:0660:form:00:variant:0","unmapped_target:dex:0663:form:00:variant:0","unmapped_target:dex:0666:form:18:variant:0","unmapped_target:dex:0668:form:00:variant:0","unmapped_target:dex:0670:form:05:variant:0","unmapped_target:dex:0671:form:00:variant:0","unmapped_target:dex:0675:form:00:variant:0","unmapped_target:dex:0676:form:00:variant:0","unmapped_target:dex:0678:form:00:variant:0","unmapped_target:dex:0678:form:01:variant:0","unmapped_target:dex:0681:form:00:variant:0","unmapped_target:dex:0683:form:00:variant:0","unmapped_target:dex:0685:form:00:variant:0","unmapped_target:dex:0687:form:00:variant:0","unmapped_target:dex:0689:form:00:variant:0","unmapped_target:dex:0691:form:00:variant:0","unmapped_target:dex:0693:form:00:variant:0","unmapped_target:dex:0695:form:00:variant:0","unmapped_target:dex:0697:form:00:variant:0","unmapped_target:dex:0699:form:00:variant:0","unmapped_target:dex:0700:form:00:variant:0","unmapped_target:dex:0701:form:00:variant:0","unmapped_target:dex:0702:form:00:variant:0","unmapped_target:dex:0706:form:00:variant:0","unmapped_target:dex:0706:form:01:variant:0","unmapped_target:dex:0707:form:00:variant:0","unmapped_target:dex:0709:form:00:variant:0","unmapped_target:dex:0711:form:00:variant:0","unmapped_target:dex:0711:form:01:variant:0","unmapped_target:dex:0711:form:02:variant:0","unmapped_target:dex:0711:form:03:variant:0","unmapped_target:dex:0713:form:00:variant:0","unmapped_target:dex:0713:form:01:variant:0","unmapped_target:dex:0715:form:00:variant:0","unmapped_target:dex:0724:form:00:variant:0","unmapped_target:dex:0724:form:01:variant:0","unmapped_target:dex:0727:form:00:variant:0","unmapped_target:dex:0730:form:00:variant:0","unmapped_target:dex:0733:form:00:variant:0","unmapped_target:dex:0740:form:00:variant:0","unmapped_target:dex:0745:form:00:variant:0","unmapped_target:dex:0745:form:01:variant:0","unmapped_target:dex:0745:form:02:variant:0","unmapped_target:dex:0748:form:00:variant:0","unmapped_target:dex:0750:form:00:variant:0","unmapped_target:dex:0752:form:00:variant:0","unmapped_target:dex:0758:form:00:variant:0","unmapped_target:dex:0763:form:00:variant:0","unmapped_target:dex:0765:form:00:variant:0","unmapped_target:dex:0766:form:00:variant:0","unmapped_target:dex:0778:form:00:variant:0","unmapped_target:dex:0780:form:00:variant:0","unmapped_target:dex:0784:form:00:variant:0","unmapped_target:dex:0823:form:00:variant:0","unmapped_target:dex:0841:form:00:variant:0","unmapped_target:dex:0842:form:00:variant:0","unmapped_target:dex:0844:form:00:variant:0","unmapped_target:dex:0855:form:00:variant:0","unmapped_target:dex:0858:form:00:variant:0","unmapped_target:dex:0861:form:00:variant:0","unmapped_target:dex:0866:form:00:variant:0","unmapped_target:dex:0867:form:00:variant:0","unmapped_target:dex:0869:form:00:variant:0","unmapped_target:dex:0870:form:00:variant:0","unmapped_target:dex:0877:form:00:variant:0","unmapped_target:dex:0887:form:00:variant:0","unmapped_target:dex:0899:form:00:variant:0","unmapped_target:dex:0900:form:00:variant:0","unmapped_target:dex:0902:form:00:variant:0","unmapped_target:dex:0902:form:01:variant:0","unmapped_target:dex:0903:form:00:variant:0","unmapped_target:dex:0904:form:00:variant:0","unmapped_target:dex:0908:form:00:variant:0","unmapped_target:dex:0911:form:00:variant:0","unmapped_target:dex:0914:form:00: